{
  "schema": "seerrng-distributed-worker-config/v1",
  "revision": 1,
  "controllerId": "developer-controller",
  "controllerWorkerId": "developer-main",
  "workers": [
    {
      "id": "developer-main",
      "address": "https://developer-main.lan:7443",
      "enabled": true,
      "identitySha256": "1111111111111111111111111111111111111111111111111111111111111111",
      "n": "auto"
    },
    {
      "id": "worker-east",
      "address": "https://worker-east.lan:7443",
      "enabled": true,
      "identitySha256": "2222222222222222222222222222222222222222222222222222222222222222",
      "n": 16
    },
    {
      "id": "worker-west",
      "address": "https://worker-west.lan:7443",
      "enabled": false,
      "identitySha256": "3333333333333333333333333333333333333333333333333333333333333333",
      "n": 8
    }
  ]
}
